{
  "metadata": {
    "mission": "MISR",
    "name": "MISR DHR Natural Color",
    "config_type": "compositor",
    "schema_version": "1.0",
    "description": "Natural-color composition from the MISR DHR Band dimension."
  },
  "input": {
    "variable": "/Land_Parameter_Average/DHR",
    "band_dimension": "Band",
    "band_coordinate": "Band"
  },
  "channels": [
    {"name": "red", "select": {"value": "red_672nm"}},
    {"name": "green", "select": {"value": "green_558nm"}},
    {"name": "blue", "select": {"value": "blue_446nm"}}
  ],
  "processing": {
    "clip": {"min": 0.0, "max": 1.0},
    "nodata_values": [-9999.0]
  },
  "output": {
    "variable": "rgb",
    "channel_dimension": "rgb_band",
    "channel_order": ["red", "green", "blue"],
    "dtype": "float32",
    "fill_value": -9999.0
  }
}
